{
  "$schema": "../addon-sources.schema.json",
  "schemaVersion": "1.1",
  "directory": {
    "name": "WinWam Open Addon Directory",
    "repository": "https://github.com/winwam/directory",
    "description": "Retail flavor fixture."
  },
  "flavor": "Retail",
  "addons": [
    {
      "id": "retail-sample",
      "name": "Arcane Alerts",
      "summary": "Configurable combat notifications.",
      "author": "Northwind Labs",
      "sourceKind": "GitHub",
      "owner": "winwam-samples",
      "repo": "retail-sample",
      "category": "Combat"
    }
  ]
}
